{"$schema":"https://json-schema.org/draft/2020-12/schema","$id":"https://r8-kumamoto-saigai.local/schemas/reconstruction/next-action.schema.json","type":"array","items":{"type":"object","additionalProperties":false,"required":["id","programIds","applicationIds","title","description","actionType","urgency","order","prerequisites","triggerConditions","doBefore","doNotDoYet","contactPointIds","requiredDocumentIds","sourceLinkIds","publicationStatus","verificationStatus"],"properties":{"id":{"type":"string","pattern":"^action_[a-z0-9_]+$"},"programIds":{"$ref":"common.schema.json#/$defs/idArray"},"applicationIds":{"$ref":"common.schema.json#/$defs/idArray"},"title":{"type":"string","minLength":1},"description":{"type":"string","minLength":1},"actionType":{"$ref":"common.schema.json#/$defs/actionType"},"urgency":{"$ref":"common.schema.json#/$defs/urgency"},"order":{"type":"integer","minimum":1},"prerequisites":{"$ref":"common.schema.json#/$defs/idArray"},"triggerConditions":{"type":"array","items":{"type":"object"}},"doBefore":{"type":["string","null"]},"doNotDoYet":{"type":["string","null"]},"contactPointIds":{"$ref":"common.schema.json#/$defs/idArray"},"requiredDocumentIds":{"$ref":"common.schema.json#/$defs/idArray"},"sourceLinkIds":{"$ref":"common.schema.json#/$defs/idArray"},"publicationStatus":{"$ref":"common.schema.json#/$defs/publicationStatus"},"verificationStatus":{"$ref":"common.schema.json#/$defs/verificationStatus"}}}}
