[
  {
    "id":"action_repair_consult_before_payment",
    "programIds":["program_emergency_housing_repair"],
    "applicationIds":["application_r8_kumamoto_emergency_repair"],
    "title":"修理業者へ支払う前に市町村へ相談する",
    "description":"熊本県の案内では、修理業者へ代金を支払うと制度を利用できないとされています。被災した市町村へ事前に相談してください。宇土市の受付窓口詳細は確認中です。",
    "actionType":"check_before_contract",
    "urgency":"now",
    "order":1,
    "prerequisites":[],
    "triggerConditions":[{"condition":"修理の依頼・契約・支払いを検討している"}],
    "doBefore":"修理業者への支払い前",
    "doNotDoYet":"自治体へ相談せずに修理代金を支払わない",
    "contactPointIds":["contact_kumamoto_prefecture_housing_measures_team"],
    "requiredDocumentIds":[],
    "sourceLinkIds":["source_link_action_consult_before_payment"],
    "publicationStatus":"draft",
    "verificationStatus":"partially_verified"
  },
  {
    "id":"action_repair_photograph_before_work",
    "programIds":["program_emergency_housing_repair"],
    "applicationIds":["application_r8_kumamoto_emergency_repair"],
    "title":"修理前の被害状況を写真に残す",
    "description":"修理する箇所について、工事を始める前の被害状況が分かる写真を撮影します。安全を確保できない場所へ無理に立ち入らず、困る場合は窓口へ確認してください。",
    "actionType":"photograph",
    "urgency":"now",
    "order":2,
    "prerequisites":[],
    "triggerConditions":[{"condition":"修理前で、安全に撮影できる"}],
    "doBefore":"工事開始前",
    "doNotDoYet":"安全を損なって撮影しない",
    "contactPointIds":["contact_kumamoto_prefecture_housing_measures_team"],
    "requiredDocumentIds":["document_pre_repair_photos"],
    "sourceLinkIds":["source_link_action_photograph_before_repair"],
    "publicationStatus":"draft",
    "verificationStatus":"partially_verified"
  }
]
